{
  "schema_version": 1,
  "generated_at": "2026-08-09T17:47:38.71634987Z",
  "target_content_hash": "b9f458b0917db5368c6826732f0daf19b63f157b11d22034c023c8d465794ee6",
  "qualifying_uses_on_current_hash": 7,
  "open_incident_ids": [
    "evt_87382a03-2691-4051-b304-69a599b0f856",
    "evt_b5f383c4-e3f9-483c-b498-e749c5f8dea9",
    "evt_8d22ad3a-f903-4788-a44a-e2a3fdcefd1a",
    "evt_496d5648-cd6d-454c-ac34-5177fb95e107"
  ],
  "candidate_clusters": [
    {
      "symptom_key": "execution",
      "open_event_ids": [
        "evt_87382a03-2691-4051-b304-69a599b0f856",
        "evt_b5f383c4-e3f9-483c-b498-e749c5f8dea9",
        "evt_8d22ad3a-f903-4788-a44a-e2a3fdcefd1a",
        "evt_496d5648-cd6d-454c-ac34-5177fb95e107"
      ],
      "independent_incidents": 4,
      "max_severity": "material_failure"
    }
  ],
  "state": "eligible",
  "authorized_workflow": "skill-evolution",
  "authorization_reason": "friction_recurrence:execution",
  "trigger_event_ids": [
    "evt_87382a03-2691-4051-b304-69a599b0f856",
    "evt_b5f383c4-e3f9-483c-b498-e749c5f8dea9",
    "evt_8d22ad3a-f903-4788-a44a-e2a3fdcefd1a"
  ],
  "threshold_session_id": "12b91ede-dc2d-4fea-8e07-b259702bc2b7",
  "not_before": null,
  "active_review_id": null,
  "last_completed_review_id": null,
  "review_reentry_basis": "first_eligibility",
  "target_name": "grilling",
  "target_repo_relative_path": ".claude/skills/grilling",
  "derivation_session_id": "215514b4-1da7-4c41-b7c9-1a617bd07336"
}
