{
  "schema_version": 1,
  "generated_at": "2026-08-13T13:30:20.619016307Z",
  "target_content_hash": "74bcaf2b6159d57a0a93f6683837b601afab3dae1e9094ab4b77c15b3f535a63",
  "qualifying_uses_on_current_hash": 1,
  "open_incident_ids": [
    "evt_13a76f62-a5de-49e2-a5fd-0df52189e7b6",
    "evt_aff78f32-4e39-46ce-b5e1-45e2eb1d0dd5"
  ],
  "candidate_clusters": [
    {
      "symptom_key": "execution",
      "open_event_ids": [
        "evt_13a76f62-a5de-49e2-a5fd-0df52189e7b6",
        "evt_aff78f32-4e39-46ce-b5e1-45e2eb1d0dd5"
      ],
      "independent_incidents": 1,
      "max_severity": "friction"
    }
  ],
  "state": "collecting",
  "authorized_workflow": null,
  "authorization_reason": null,
  "trigger_event_ids": [],
  "threshold_session_id": null,
  "not_before": null,
  "active_review_id": null,
  "last_completed_review_id": null,
  "review_reentry_basis": null,
  "target_name": "improve-codebase-architecture",
  "target_repo_relative_path": ".claude/skills/improve-codebase-architecture",
  "derivation_session_id": "827703fb-f235-4245-a718-173339cdd3f5"
}
