{
  "schema_version": 1,
  "generated_at": "2026-08-10T00:18:10.072702471Z",
  "target_content_hash": "b4aaa5ea17450343dfa971ab4f08a9a4427c36b1f956579c96f270e90e3af9dd",
  "qualifying_uses_on_current_hash": 2,
  "open_incident_ids": [],
  "candidate_clusters": [],
  "state": "closed",
  "authorized_workflow": null,
  "authorization_reason": null,
  "trigger_event_ids": [],
  "threshold_session_id": null,
  "not_before": null,
  "active_review_id": null,
  "last_completed_review_id": "rev_5045213f-d3a2-47f9-8b08-e0634c6103b0",
  "review_reentry_basis": null,
  "target_name": "implement",
  "target_repo_relative_path": ".claude/skills/implement",
  "derivation_session_id": "019fe8dc-5612-7183-9d79-843b9e320cb8"
}
