{
  "schema_version": 1,
  "generated_at": "2026-08-09T19:14:56.058659Z",
  "target_content_hash": "58ee690ec479d13e9ff51567f4e57087f319ac7a1aca6511d61c8628f5e43fa6",
  "qualifying_uses_on_current_hash": 9,
  "open_incident_ids": [
    "evt_7814cfa8-ad78-4511-b202-f78ad96902d3",
    "evt_d8187585-0e16-4fb6-b72d-380cdefb256d"
  ],
  "candidate_clusters": [
    {
      "symptom_key": "output",
      "open_event_ids": [
        "evt_7814cfa8-ad78-4511-b202-f78ad96902d3"
      ],
      "independent_incidents": 1,
      "max_severity": "material_failure"
    },
    {
      "symptom_key": "execution",
      "open_event_ids": [
        "evt_d8187585-0e16-4fb6-b72d-380cdefb256d"
      ],
      "independent_incidents": 1,
      "max_severity": "material_failure"
    }
  ],
  "state": "collecting",
  "authorized_workflow": null,
  "authorization_reason": null,
  "trigger_event_ids": [],
  "threshold_session_id": null,
  "not_before": null,
  "active_review_id": null,
  "last_completed_review_id": "rev_cbbe933b-a491-416e-b0bf-080c3b5eefa1",
  "review_reentry_basis": null,
  "target_name": "code-review",
  "target_repo_relative_path": ".claude/skills/code-review",
  "derivation_session_id": "ba3e0c87-74fc-4aff-a2ec-400042b7356a"
}
