{
  "schema_version": 1,
  "generated_at": "2026-08-09T08:38:57.608743335Z",
  "target_content_hash": "5bc32c8a31d750428f7a914248487ce1c884f6b87f112a2d3fff1c087cd31596",
  "qualifying_uses_on_current_hash": 3,
  "open_incident_ids": [
    "evt_87b4b1cc-f366-4174-8a75-8004c2f4dc3e",
    "evt_5de70780-434c-4ff6-ae2a-50b524975f82"
  ],
  "candidate_clusters": [
    {
      "symptom_key": "execution",
      "open_event_ids": [
        "evt_87b4b1cc-f366-4174-8a75-8004c2f4dc3e",
        "evt_5de70780-434c-4ff6-ae2a-50b524975f82"
      ],
      "independent_incidents": 2,
      "max_severity": "friction"
    }
  ],
  "state": "collecting",
  "authorized_workflow": null,
  "authorization_reason": null,
  "trigger_event_ids": [],
  "threshold_session_id": null,
  "not_before": null,
  "active_review_id": null,
  "last_completed_review_id": null,
  "review_reentry_basis": null,
  "target_name": "triage",
  "target_repo_relative_path": ".claude/skills/triage",
  "derivation_session_id": "6c8374b2-52de-4f02-bc2b-4c1c4b094d6c"
}
