{
  "schema_version": 1,
  "generated_at": "2026-08-11T20:21:33.578351796Z",
  "target_content_hash": "b243e73f963b932b4898e089a4babe97a2678ceb9b032f465485223d6905f570",
  "qualifying_uses_on_current_hash": 8,
  "open_incident_ids": [
    "evt_ee269434-1b57-4abe-818b-c30a87a9e7d5",
    "evt_681398fd-9eda-4ff0-8053-12365f75a69f",
    "evt_5212db6c-747d-4022-8ea9-e025495cfaa8"
  ],
  "candidate_clusters": [
    {
      "symptom_key": "cost",
      "open_event_ids": [
        "evt_ee269434-1b57-4abe-818b-c30a87a9e7d5"
      ],
      "independent_incidents": 1,
      "max_severity": "friction"
    },
    {
      "symptom_key": "output",
      "open_event_ids": [
        "evt_681398fd-9eda-4ff0-8053-12365f75a69f"
      ],
      "independent_incidents": 1,
      "max_severity": "material_failure"
    },
    {
      "symptom_key": "tool-compatibility",
      "open_event_ids": [
        "evt_5212db6c-747d-4022-8ea9-e025495cfaa8"
      ],
      "independent_incidents": 1,
      "max_severity": "friction"
    }
  ],
  "state": "collecting",
  "authorized_workflow": null,
  "authorization_reason": null,
  "trigger_event_ids": [],
  "threshold_session_id": null,
  "not_before": null,
  "active_review_id": null,
  "last_completed_review_id": null,
  "review_reentry_basis": null,
  "target_name": "writing-great-skills",
  "target_repo_relative_path": ".claude/skills/writing-great-skills",
  "derivation_session_id": "019ff218-cdc3-7033-a3f0-03853108f7f4"
}
