{
  "schema_version": 1,
  "generated_at": "2026-08-11T17:38:00.297621042Z",
  "target_content_hash": "655871f2a47ce8167fe20070a2f442abb7bef10db2d1e41bf4a06b36c1e65723",
  "qualifying_uses_on_current_hash": 1,
  "open_incident_ids": [],
  "candidate_clusters": [],
  "state": "closed",
  "authorized_workflow": null,
  "authorization_reason": null,
  "trigger_event_ids": [],
  "threshold_session_id": null,
  "not_before": null,
  "active_review_id": null,
  "last_completed_review_id": null,
  "review_reentry_basis": null,
  "target_name": "research-brief",
  "target_repo_relative_path": ".claude/skills/research-brief",
  "derivation_session_id": "019ff0d0-f8aa-7222-85f8-a44fe21cf323"
}
