{
  "schema_version": 1,
  "generated_at": "2026-08-11T12:51:44.090935499Z",
  "target_content_hash": "9eb7c59cee52e2c5cf7aa49da1ba9abcdfc9720c2cc6862db88780094eeb3697",
  "qualifying_uses_on_current_hash": 3,
  "open_incident_ids": [
    "evt_55374fb2-af26-4875-8081-3222a754d76a"
  ],
  "candidate_clusters": [
    {
      "symptom_key": "output",
      "open_event_ids": [
        "evt_55374fb2-af26-4875-8081-3222a754d76a"
      ],
      "independent_incidents": 1,
      "max_severity": "material_failure"
    }
  ],
  "state": "collecting",
  "authorized_workflow": null,
  "authorization_reason": null,
  "trigger_event_ids": [],
  "threshold_session_id": null,
  "not_before": null,
  "active_review_id": null,
  "last_completed_review_id": null,
  "review_reentry_basis": null,
  "target_name": "skill-evolution-status",
  "target_repo_relative_path": ".claude/skills/skill-evolution-status",
  "derivation_session_id": "019ff0b5-d605-7e91-9355-3cc9ed0fffc2"
}
